{
  "metricsVersion": "stage-metrics-v1",
  "runId": "NCS_MAPPING_OBSERVED_20260806_01",
  "runMode": "observed-dev",
  "stageId": "A4-02-RETRIEVAL",
  "contractVersion": "2.1.2",
  "crawlReleaseId": "CRAWL_20260806_03",
  "dataVersion": "observed-dev-20260806.1",
  "dataProvenance": "OBSERVED_DEVELOPMENT_ONLY",
  "empiricalAnalysisAllowed": false,
  "promotionAllowed": false,
  "generatedAt": "2026-08-06T09:16:50.969817Z",
  "metrics": [
    {
      "metricId": "lexicalDocumentRows",
      "value": 691,
      "numerator": null,
      "denominator": null,
      "unit": "count",
      "grain": "ncsUnitCode",
      "unknownHandling": "unknown retained; no empirical inference",
      "status": "INFORMATIONAL"
    },
    {
      "metricId": "aliasRows",
      "value": 10,
      "numerator": null,
      "denominator": null,
      "unit": "count",
      "grain": "alias",
      "unknownHandling": "unknown retained; no empirical inference",
      "status": "INFORMATIONAL"
    }
  ]
}
