{
  "metricsVersion": "stage-metrics-v1",
  "runId": "OBSERVED_DEV_20260806_01-A2-00-CONTRACT-AUDIT",
  "runMode": "observed-dev",
  "stageId": "A2-00-CONTRACT-AUDIT",
  "contractVersion": "2.1.2",
  "crawlReleaseId": "CRAWL_20260806_03",
  "dataVersion": "observed-dev-20260806.1",
  "dataProvenance": "OBSERVED_DEVELOPMENT_ONLY",
  "empiricalAnalysisAllowed": false,
  "promotionAllowed": false,
  "generatedAt": "2026-08-06T00:00:00+09:00",
  "metrics": [
    {
      "metricId": "canonicalDatabaseObjectCount",
      "value": 32,
      "numerator": null,
      "denominator": null,
      "unit": "count",
      "grain": "stage",
      "unknownHandling": "null preserved; zero denominator is NOT_EVALUATED",
      "status": "INFORMATIONAL"
    },
    {
      "metricId": "checksumCount",
      "value": 6,
      "numerator": null,
      "denominator": null,
      "unit": "count",
      "grain": "stage",
      "unknownHandling": "null preserved; zero denominator is NOT_EVALUATED",
      "status": "INFORMATIONAL"
    },
    {
      "metricId": "checksumPassed",
      "value": true,
      "numerator": null,
      "denominator": null,
      "unit": "flag",
      "grain": "stage",
      "unknownHandling": "null preserved; zero denominator is NOT_EVALUATED",
      "status": "INFORMATIONAL"
    },
    {
      "metricId": "contractVersion",
      "value": "2.1.2",
      "numerator": null,
      "denominator": null,
      "unit": "value",
      "grain": "stage",
      "unknownHandling": "null preserved; zero denominator is NOT_EVALUATED",
      "status": "INFORMATIONAL"
    },
    {
      "metricId": "empiricalAnalysisAllowed",
      "value": false,
      "numerator": null,
      "denominator": null,
      "unit": "flag",
      "grain": "stage",
      "unknownHandling": "null preserved; zero denominator is NOT_EVALUATED",
      "status": "INFORMATIONAL"
    },
    {
      "metricId": "failedGates",
      "value": "[{\"blocking\": true, \"failedGate\": \"fullCorpus\", \"observedValue\": false}]",
      "numerator": null,
      "denominator": null,
      "unit": "value",
      "grain": "stage",
      "unknownHandling": "null preserved; zero denominator is NOT_EVALUATED",
      "status": "INFORMATIONAL"
    },
    {
      "metricId": "fullCorpusAcceptance",
      "value": "FAIL",
      "numerator": null,
      "denominator": null,
      "unit": "value",
      "grain": "stage",
      "unknownHandling": "null preserved; zero denominator is NOT_EVALUATED",
      "status": "INFORMATIONAL"
    },
    {
      "metricId": "observedBatch.assetRows",
      "value": 0,
      "numerator": null,
      "denominator": null,
      "unit": "count",
      "grain": "stage",
      "unknownHandling": "null preserved; zero denominator is NOT_EVALUATED",
      "status": "INFORMATIONAL"
    },
    {
      "metricId": "observedBatch.postingManifestRows",
      "value": 137,
      "numerator": null,
      "denominator": null,
      "unit": "count",
      "grain": "stage",
      "unknownHandling": "null preserved; zero denominator is NOT_EVALUATED",
      "status": "INFORMATIONAL"
    },
    {
      "metricId": "observedBatch.rawDetailManifestRows",
      "value": 29,
      "numerator": null,
      "denominator": null,
      "unit": "count",
      "grain": "stage",
      "unknownHandling": "null preserved; zero denominator is NOT_EVALUATED",
      "status": "INFORMATIONAL"
    },
    {
      "metricId": "observedBatch.uniquePostingIds",
      "value": 137,
      "numerator": null,
      "denominator": null,
      "unit": "count",
      "grain": "stage",
      "unknownHandling": "null preserved; zero denominator is NOT_EVALUATED",
      "status": "INFORMATIONAL"
    },
    {
      "metricId": "packageId",
      "value": "OBSERVED_INPUT_20260806_01",
      "numerator": null,
      "denominator": null,
      "unit": "value",
      "grain": "stage",
      "unknownHandling": "null preserved; zero denominator is NOT_EVALUATED",
      "status": "INFORMATIONAL"
    },
    {
      "metricId": "promotionAllowed",
      "value": false,
      "numerator": null,
      "denominator": null,
      "unit": "flag",
      "grain": "stage",
      "unknownHandling": "null preserved; zero denominator is NOT_EVALUATED",
      "status": "INFORMATIONAL"
    },
    {
      "metricId": "releaseId",
      "value": "CRAWL_20260806_03",
      "numerator": null,
      "denominator": null,
      "unit": "value",
      "grain": "stage",
      "unknownHandling": "null preserved; zero denominator is NOT_EVALUATED",
      "status": "INFORMATIONAL"
    },
    {
      "metricId": "sourceAdapterConformance",
      "value": "PASS",
      "numerator": null,
      "denominator": null,
      "unit": "value",
      "grain": "stage",
      "unknownHandling": "null preserved; zero denominator is NOT_EVALUATED",
      "status": "INFORMATIONAL"
    },
    {
      "metricId": "stage",
      "value": "00ContractAndInputAudit",
      "numerator": null,
      "denominator": null,
      "unit": "value",
      "grain": "stage",
      "unknownHandling": "null preserved; zero denominator is NOT_EVALUATED",
      "status": "INFORMATIONAL"
    }
  ]
}
