{
  "metricsVersion": "stage-metrics-v1",
  "runId": "NCS_MAPPING_OBSERVED_20260806_01",
  "runMode": "observed-dev",
  "stageId": "A4-01-CODESET",
  "contractVersion": "2.1.2",
  "crawlReleaseId": "CRAWL_20260806_03",
  "dataVersion": "observed-dev-20260806.1",
  "dataProvenance": "OBSERVED_DEVELOPMENT_ONLY",
  "empiricalAnalysisAllowed": false,
  "promotionAllowed": false,
  "generatedAt": "2026-08-06T08:49:33.920028Z",
  "metrics": [
    {
      "metricId": "coreCodeRows",
      "value": 120,
      "numerator": null,
      "denominator": null,
      "unit": "count",
      "grain": "ncsSubCode",
      "unknownHandling": "unknown retained; no empirical inference",
      "status": "INFORMATIONAL"
    },
    {
      "metricId": "includedDevelopmentCodes",
      "value": 69,
      "numerator": null,
      "denominator": null,
      "unit": "count",
      "grain": "ncsSubCode",
      "unknownHandling": "unknown retained; no empirical inference",
      "status": "INFORMATIONAL"
    },
    {
      "metricId": "excludedDevelopmentCodes",
      "value": 51,
      "numerator": null,
      "denominator": null,
      "unit": "count",
      "grain": "ncsSubCode",
      "unknownHandling": "unknown retained; no empirical inference",
      "status": "INFORMATIONAL"
    }
  ]
}
