{
  "metricsVersion": "stage-metrics-v1",
  "runId": "observed-dev-20260806.1",
  "runMode": "observed-dev",
  "stageId": "A1-03-ASSET",
  "contractVersion": "2.1.2",
  "crawlReleaseId": "CRAWL_20260806_03",
  "dataVersion": "observed-dev-20260806.1",
  "dataProvenance": "OBSERVED_DEVELOPMENT_ONLY",
  "empiricalAnalysisAllowed": false,
  "promotionAllowed": false,
  "generatedAt": "2026-08-06T00:00:00+09:00",
  "metrics": [
    {
      "metricId": "metadataCandidates",
      "value": 59,
      "numerator": 59,
      "denominator": null,
      "unit": "count",
      "grain": "A1-03-ASSET",
      "unknownHandling": "preserve_unknown",
      "status": "INFORMATIONAL"
    },
    {
      "metricId": "ocrCandidates",
      "value": 30,
      "numerator": 30,
      "denominator": null,
      "unit": "count",
      "grain": "A1-03-ASSET",
      "unknownHandling": "preserve_unknown",
      "status": "INFORMATIONAL"
    },
    {
      "metricId": "assetsFetched",
      "value": 0,
      "numerator": 0,
      "denominator": null,
      "unit": "count",
      "grain": "A1-03-ASSET",
      "unknownHandling": "preserve_unknown",
      "status": "INFORMATIONAL"
    },
    {
      "metricId": "externalAtsTransportCalls",
      "value": 0,
      "numerator": 0,
      "denominator": null,
      "unit": "count",
      "grain": "A1-03-ASSET",
      "unknownHandling": "preserve_unknown",
      "status": "INFORMATIONAL"
    },
    {
      "metricId": "routingMode",
      "value": "METADATA_ONLY",
      "numerator": null,
      "denominator": null,
      "unit": "value",
      "grain": "A1-03-ASSET",
      "unknownHandling": "preserve_unknown",
      "status": "INFORMATIONAL"
    }
  ]
}
